{"schema_version":"1.0.0","campaign_id":"m0","scope_hash":"aaaaaaaaaaaaaaaaaaaaaaaaaaaaaaaaaaaaaaaaaaaaaaaaaaaaaaaaaaaaaaaa","resolved_sources":[{"path":"feature/smoke.feature","sha256":"aaaaaaaaaaaaaaaaaaaaaaaaaaaaaaaaaaaaaaaaaaaaaaaaaaaaaaaaaaaaaaaa"}],"catalog_revision":"v1","bindings_revision":"v1","cases":[{"case_id":"SMOKE-1","applicability":"applicable"}],"environment_intent":{"environment_id":"lab-mock","environment_instance_id":null},"composition_digest":"aaaaaaaaaaaaaaaaaaaaaaaaaaaaaaaaaaaaaaaaaaaaaaaaaaaaaaaaaaaaaaaa","prerequisites":[{"id":"catalog","depends_on":[]}],"deadlines":{"bootstrap":"300s"},"concurrency":{"max_parallel":1},"retry_policy":{"max_attempts":1,"stateful_replay":false}}
